{
  "schema_version": "0-draft",
  "analysis_id": "empty",
  "quality": { "overall": 0.9, "warnings": [] },
  "stroke": { "type": "overhead_clear", "confidence": 0.86 },
  "features": [
    {
      "name": "dominant_elbow_angle_at_max_wrist_height_deg",
      "value": 160,
      "unit": "deg",
      "confidence": 0.9,
      "available": true,
      "feature_version": "1"
    }
  ],
  "findings": [],
  "versions": { "pose_estimator": "mediapipe", "feature_schema": "1", "rule_set": "1" }
}
