{
  "schema_version": "0-draft",
  "analysis_id": "inconclusive",
  "quality": { "overall": 0.31, "warnings": ["low_pose_confidence"] },
  "stroke": { "type": "overhead_clear", "confidence": 0.2 },
  "features": [
    {
      "name": "dominant_elbow_angle_at_max_wrist_height_deg",
      "value": null,
      "unit": "deg",
      "confidence": 0.2,
      "available": false,
      "feature_version": "1"
    }
  ],
  "findings": [],
  "versions": { "pose_estimator": "mediapipe", "feature_schema": "1", "rule_set": "1" }
}
